issue_id,title,start,end,total_reactions,total_comments,new_reactions,new_comments,issue_url
flutter/flutter#52522,"[in_app_purchase] Support InApp purchase local verification",2024-01-26,2024-03-08,34,11,0,1,https://github.com/flutter/flutter/issues/52522
flutter/flutter#118481,"[web] Multi-view Embedding Support",2024-01-26,2024-02-25,29,9,0,3,https://github.com/flutter/flutter/issues/118481
flutter/flutter#14720,"Flutter can receive touches even when hidden behind another native ViewController",2024-01-26,2024-03-08,25,39,0,2,https://github.com/flutter/flutter/issues/14720
flutter/flutter#54029,"AnnotatedRegion not working on iOS (to set status bar icon color)",2024-01-26,2024-03-08,24,15,0,1,https://github.com/flutter/flutter/issues/54029
flutter/flutter#27293,"Wrapped Text has unexpected intrinsic size",2024-01-26,2024-03-08,22,24,0,2,https://github.com/flutter/flutter/issues/27293
flutter/flutter#31376," Programmatically trigger a CupertinoSliverRefreshControl refresh",2024-01-26,2024-03-08,20,5,0,2,https://github.com/flutter/flutter/issues/31376
flutter/flutter#119398,"[go_router] `routerNeglect` does not seem to work",2024-01-26,2024-03-08,19,18,0,1,https://github.com/flutter/flutter/issues/119398
flutter/flutter#78200,"PageView: Add parameter to specify marging between pages",2024-01-26,2024-03-07,12,6,0,1,https://github.com/flutter/flutter/issues/78200
flutter/flutter#37159,"Roku support",2024-01-26,2024-03-08,59,11,0,1,https://github.com/flutter/flutter/issues/37159
flutter/flutter#15953,"[camera] Improve CameraPreview to size itself appropriate for video and picture previews ",2024-01-26,2024-03-08,54,56,0,1,https://github.com/flutter/flutter/issues/15953
flutter/flutter#44572,"Path.combine not implemented in the HTML backend",2024-01-26,2024-03-08,37,30,0,2,https://github.com/flutter/flutter/issues/44572
flutter/flutter#77883,"Idea: match platform scrolling behavior with Flutter using HTML scrollable area",2024-01-26,2024-03-08,33,18,0,1,https://github.com/flutter/flutter/issues/77883
flutter/flutter#48464,"When popping a route, controls should reacquire focus without opening the keyboard or scrolling to make visible.",2024-01-26,2024-03-08,30,26,0,1,https://github.com/flutter/flutter/issues/48464
flutter/flutter#79172,"[web] complex characters are rendered incorrectly",2024-01-26,2024-03-08,23,20,0,1,https://github.com/flutter/flutter/issues/79172
flutter/flutter#79605,"Memory leak with Stateless Widget",2024-01-26,2024-03-08,19,57,0,4,https://github.com/flutter/flutter/issues/79605
flutter/flutter#78216,"Disable scroll actions for embedded Flutter web app",2024-01-26,2024-03-08,19,29,0,1,https://github.com/flutter/flutter/issues/78216
flutter/flutter#43721,"[google_maps_flutter] Padding not working on android",2024-01-26,2024-03-08,16,21,0,1,https://github.com/flutter/flutter/issues/43721
flutter/flutter#53017,"[video_player] Allow creating a video player controller from bytes stream (e.g., Uint8List)",2024-01-26,2024-03-08,14,15,0,9,https://github.com/flutter/flutter/issues/53017
flutter/flutter#106170,"[Proposal] Modify 300ms delay when using double tap ",2024-02-05,2024-03-08,13,11,0,2,https://github.com/flutter/flutter/issues/106170
flutter/flutter#54126,"Adding debuggable:true to Android release build prevents VM initialization",2024-02-09,2024-03-06,12,13,0,1,https://github.com/flutter/flutter/issues/54126
flutter/flutter#11754,"Allow release mode builds to run on simulators",2024-01-26,2024-03-08,171,52,0,3,https://github.com/flutter/flutter/issues/11754
flutter/flutter#40601,"Horizontal Stepper Overflows Title (with no way to allow for scrolling)",2024-01-26,2024-03-08,68,60,0,1,https://github.com/flutter/flutter/issues/40601
flutter/flutter#44681,"Prevent soft keyboard to show when physical keyboard is used",2024-01-26,2024-03-08,30,24,0,1,https://github.com/flutter/flutter/issues/44681
flutter/flutter#59332,"Flutter Web: ListView lags a lot on mobile browsers, inconsistent performance on different devices on different browsers",2024-01-26,2024-03-08,22,34,0,1,https://github.com/flutter/flutter/issues/59332
flutter/flutter#73260,"Installation on Alpine Linux container: unable to 'pub upgrade'",2024-01-26,2024-03-08,18,28,0,1,https://github.com/flutter/flutter/issues/73260
flutter/flutter#99460,"The following _CastError was thrown during a service extension callback for ""ext.flutter.inspector.getRootWidgetSummaryTree""",2024-01-26,2024-03-08,17,21,0,3,https://github.com/flutter/flutter/issues/99460
flutter/flutter#26000,"iOS Google Maps: Strange appear animation",2024-01-26,2024-03-08,17,20,0,1,https://github.com/flutter/flutter/issues/26000
flutter/flutter#71278,"Web: Flutter does not fill out entire screen in landscape on iOS Safari iPhone XS Max",2024-01-26,2024-03-08,12,19,0,2,https://github.com/flutter/flutter/issues/71278
flutter/flutter#36283,"Can't swipe to dismiss scrollable Bottom Sheet",2024-01-26,2024-03-08,62,34,0,3,https://github.com/flutter/flutter/issues/36283
flutter/flutter#78746,"Autocomplete widget goes out of screen from right side",2024-01-26,2024-03-08,42,38,0,1,https://github.com/flutter/flutter/issues/78746
flutter/flutter#42833,"Text decoration underline is not aligning some characters or space",2024-01-26,2024-03-08,37,31,0,3,https://github.com/flutter/flutter/issues/42833
flutter/flutter#16810,"Seeing a green rectangle around the border of the gallery app when I run it",2024-01-26,2024-03-08,26,40,0,3,https://github.com/flutter/flutter/issues/16810
flutter/flutter#68215,"From ""flutter run"" the app shows ""In iOS 14+, debug mode Flutter apps can only be launched from Flutter tooling..."" warning",2024-01-26,2024-03-08,21,63,0,3,https://github.com/flutter/flutter/issues/68215
flutter/flutter#84241,"[desktop] `'!_debugDuringDeviceUpdate': is not true` exception thrown",2024-01-26,2024-03-08,20,33,0,1,https://github.com/flutter/flutter/issues/84241
flutter/flutter#59552,"Flutter flashes black screen on Android when resuming",2024-01-26,2024-03-08,19,32,0,3,https://github.com/flutter/flutter/issues/59552
flutter/flutter#41707,"Text layout without blocking the UI",2024-01-26,2024-03-08,19,17,0,1,https://github.com/flutter/flutter/issues/41707
flutter/flutter#36925,"[webview_flutter] Add an option to bypass SSL checks",2024-01-26,2024-03-08,19,18,0,1,https://github.com/flutter/flutter/issues/36925
flutter/flutter#57090,"[webview_flutter] Support disabling overscroll",2024-01-26,2024-03-08,16,6,0,1,https://github.com/flutter/flutter/issues/57090
flutter/flutter#76988,"EventChannel is not working when app is in background",2024-01-26,2024-03-08,15,20,0,2,https://github.com/flutter/flutter/issues/76988
flutter/flutter#54400,"WidgetSpans in RTL text laying out LTR if they occur on the same line",2024-01-26,2024-03-08,15,30,0,1,https://github.com/flutter/flutter/issues/54400
